{}, This will be my favorite as it is so good. You definitely need to try it, otherwise youwill definitely regret,
I like {} so much. I am wondering how to do but the online tutorial is not good enough,
If you never try {} before your life lacks so much fun. So don't hesitate just get this and try it,
I even don't know you like {} too. So great to share it with someone like you. You can even give some advices to improve it,
I would like to introduce you my favorite {}, as it is so amazing such that you will never forget it after you take it,
Great to hear that you like {} too. Perhaps we can find a time to have a deeper discussion on this as it's both ours favorites,
I am very sorry to know that you hate {}. However, I would strongly suggest you to try it again as it is really really good,
In terms of {}, I guess I am not one hundred percent sure that you actually get the point, so I will find a time to explain to you gain,
You don't know {} at all but i would say ok, as I am going to find you and make you try it one more time, with proper instructions,
